{
  "$schema": "https://json-schema.org/draft/2020-12/schema",
  "title": "EC2 Instance Configuration",
  "description": "Schema for validating terraform.tfvars.json files used by the EC2 provisioning module.",
  "type": "object",
  "required": [
    "account_id",
    "platform",
    "os_type",
    "instance_type",
    "key_name",
    "subnet_type",
    "default_tags",
    "request_number"
  ],
  "properties": {
    "$schema": {
      "type": "string",
      "description": "JSON Schema reference used by editors such as VS Code.",
      "const": "schema.tfvars.json"
    },
    "request_number": {
      "type": "string",
      "description": "ServiceNow request Number",
      "pattern": "^RITM\\d{7}$"
    },
    "account_id": {
      "type": "string",
      "description": "AWS account ID where the EC2 instance will be deployed.",
      "pattern": "^\\d{12}$"
    },
    "account_id_sharedservices": {
      "type": "string",
      "description": "AWS Shared Services account ID used for centralized services such as backup, monitoring, logging, or IAM integrations.",
      "pattern": "^\\d{12}$"
    },
    "instance_count": {
      "type": "integer",
      "description": "Number of EC2 instances to create.",
      "minimum": 1,
      "default": 1
    },
    "os_type": {
      "type": "string",
      "description": "Operating system image to deploy.",
      "enum": [
        "win2016",
        "win2019",
        "win2022",
        "win2023",
        "win2025",
        "rhel8",
        "rhel9",
        "al2023"
      ]
    },
    "instance_type": {
      "type": "string",
      "description": "EC2 instance type, for example t3.medium, m5.xlarge, r7i.large."
    },
    "ami_id": {
      "type": [
        "string",
        "null"
      ],
      "description": "Optional custom AMI ID. If omitted, the module automatically selects an approved AMI based on os_type.",
      "pattern": "^ami-[a-zA-Z0-9]+$"
    },
    "key_name": {
      "type": "string",
      "description": "EC2 key pair name used for administrative access."
    },
    "subnet_type": {
      "type": "string",
      "description": "Subnet tier used for instance placement.",
      "enum": [
        "private",
        "public",
        "app",
        "internal",
        "db"
      ]
    },
    "availability_zone": {
      "type": [
        "string",
        "null"
      ],
      "description": "Specific Availability Zone for deployment. Leave null to allow automatic subnet selection.",
      "pattern": "^[a-z]{2}-[a-z]+-[0-9][a-z]$"
    },
    "subnet_id": {
      "type": [
        "string",
        "null"
      ],
      "description": "Optional subnet ID. When specified, subnet discovery and subnet_type selection are bypassed.",
      "pattern": "^subnet-[a-zA-Z0-9]+$"
    },
    "root_disk_size": {
      "type": "integer",
      "description": "Root EBS volume size in GiB.",
      "minimum": 1,
      "default": 40
    },
    "root_disk_type": {
      "type": "string",
      "description": "Root EBS volume type.",
      "default": "gp3",
      "examples": [
        "gp3",
        "gp2",
        "io1",
        "io2"
      ]
    },
    "root_disk_iops": {
      "type": "integer",
      "description": "Provisioned IOPS for the root EBS volume.",
      "minimum": 0,
      "default": 3000
    },
    "ebs_volumes": {
      "type": "object",
      "description": "Additional EBS volumes attached to the EC2 instance. Keys should represent device names.",
      "default": {},
      "additionalProperties": {
        "type": "object",
        "required": [
          "size"
        ],
        "properties": {
          "size": {
            "type": "integer",
            "description": "Volume size in GiB.",
            "minimum": 1
          },
          "type": {
            "type": "string",
            "description": "EBS volume type.",
            "default": "gp3"
          },
          "encrypted": {
            "type": "boolean",
            "description": "Whether the volume should be encrypted.",
            "default": true
          },
          "iops": {
            "type": "integer",
            "description": "Provisioned IOPS for the volume.",
            "minimum": 0,
            "default": 3000
          },
          "snapshot_id": {
            "type": [
              "string",
              "null"
            ],
            "description": "Optional snapshot ID used to create the volume.",
            "pattern": "^snap-[a-zA-Z0-9]+$"
          }
        },
        "additionalProperties": false
      }
    },
    "schedule": {
      "type": "string",
      "description": "Schedule tag value used by instance scheduling automation.",
      "default": "none"
    },
    "backup_plan": {
      "type": "string",
      "description": "Backup plan tag value used by AWS Backup automation.",
      "default": "ec2"
    },
    "user_data_file": {
      "type": [
        "string",
        "null"
      ],
      "description": "Name of a user-data script located in the userdata directory of the repository. The file contents are loaded and supplied during instance provisioning."
    },
    "create_iam_instance_profile": {
      "type": "boolean",
      "description": "Create a new IAM role and instance profile for the EC2 instance.",
      "default": true
    },
    "iam_instance_profile": {
      "type": [
        "string",
        "null"
      ],
      "description": "Existing IAM instance profile name to use when create_iam_instance_profile is false."
    },
    "iam_role_policies": {
      "type": "object",
      "description": "Map of policy name to IAM policy ARN to attach to the generated IAM role.",
      "default": {},
      "additionalProperties": {
        "type": "string",
        "pattern": "^arn:aws:iam::aws:policy/.+|^arn:aws:iam::\\d{12}:policy/.+"
      }
    },
    "security_group_ids": {
      "type": "array",
      "description": "List of existing security groups to attach to the instance.",
      "default": [],
      "items": {
        "type": "string",
        "pattern": "^sg-[a-zA-Z0-9]+$"
      }
    },
    "ingress_rules": {
      "type": "object",
      "description": "Ingress rules used when a security group is automatically created by the module.",
      "default": {},
      "additionalProperties": {
        "type": "object",
        "properties": {
          "cidr_ipv4": {
            "type": "string",
            "description": "IPv4 CIDR block allowed by the rule."
          },
          "description": {
            "type": "string",
            "description": "Description of the ingress rule."
          },
          "from_port": {
            "type": "integer",
            "description": "Starting port number.",
            "minimum": 0,
            "maximum": 65535
          },
          "ip_protocol": {
            "type": "string",
            "description": "Network protocol.",
            "default": "tcp",
            "enum": [
              "tcp",
              "udp"
            ]
          },
          "prefix_list_id": {
            "type": "string",
            "description": "AWS managed prefix list ID."
          },
          "referenced_security_group_id": {
            "type": "string",
            "description": "Source security group ID permitted by this rule.",
            "pattern": "^sg-[a-zA-Z0-9]+$"
          },
          "tags": {
            "type": "object",
            "description": "Additional tags applied to the rule.",
            "default": {},
            "additionalProperties": {
              "type": "string"
            }
          },
          "to_port": {
            "type": "integer",
            "description": "Ending port number.",
            "minimum": 0,
            "maximum": 65535
          }
        },
        "additionalProperties": false
      }
    },
    "additional_tags": {
      "type": "object",
      "description": "Additional tags applied to the EC2 instance and attached resources.",
      "default": {},
      "additionalProperties": {
        "type": "string"
      }
    },
    "instance_name": {
      "type": [
        "string",
        "null"
      ],
      "description": "Value used for the Name tag of the EC2 instance."
    },
    "create_default_sg": {
      "type": "boolean",
      "description": "Create and manage a dedicated security group for this instance.",
      "default": true
    },
    "platform": {
      "type": "string",
      "description": "Underlying operating system platform.",
      "enum": [
        "linux",
        "windows"
      ]
    },
    "default_tags": {
      "type": "object",
      "description": "Mandatory organisational tags applied to all resources.",
      "required": [
        "App",
        "Environment",
        "Capability",
        "CostCenter",
        "Source"
      ],
      "properties": {
        "App": {
          "type": "string",
          "description": "Application or service identifier."
        },
        "Environment": {
          "type": "string",
          "description": "Deployment environment such as dev, test, nonprod, or prod."
        },
        "Capability": {
          "type": "string",
          "description": "Business capability or application classification."
        },
        "CostCenter": {
          "type": "string",
          "description": "Financial cost centre responsible for the resource."
        },
        "Source": {
          "type": "string",
          "description": "Provisioning source reference such as GitHub repository, service request, or change request."
        }
      },
      "additionalProperties": false
    }
  },
  "additionalProperties": false
}