{
    "request_number": "RITM0000101",
    "account_id": "123456789012",
    "instance_count": 1,
    "instance_type": "t3.micro",
    "os_type": "al2023",
    "platform": "linux",
    "instance_name": "demo-instance",
    "subnet_type": "public",
    "availability_zone": "ap-south-1a",
    "key_name": "my-key",
    "root_disk_size": 8,
    "root_disk_iops": 3000,
    "root_disk_type": "gp3",
    "create_iam_instance_profile": false,
    "create_default_sg": true,
    "default_tags": {
        "App": "demo",
        "Environment": "dev",
        "Capability": "poc",
        "CostCenter": "1234",
        "Source": "blazop"
    }
}